id,title,synopsis,genres,release_date,episodes,members,popularity,ranked,score,img_url,link
2966,Ookami to Koushinryou,Holo is a powerful wolf deity who is celebrated and revered in the small town of Pasloe for blessing the annual harvest. Yet as years go by and the villagers become more self-sufficient Holo who stylizes herself as the Wise Wolf of Yoitsu has been reduced to a mere folk tale. When a traveling merchant named Kraft Lawrence stops at Pasloe Holo offers to become his business partner if he eventually takes her to her northern home of Yoitsu. The savvy trader recognizes Holo's unusual ability to evaluate a person's character and accepts her proposition. Now in the possession of both sharp business skills and a charismatic negotiator Lawrence inches closer to his goal of opening his own shop. However as Lawrence travels the countryside with Holo in search of economic opportunities he begins to realize that his aspirations are slowly morphing into something unexpected. Based on the popular light novel of the same name Ookami to Koushinryou  also known as Spice and Wolf  fuses the two polar genres of economics and romance to create an enthralling story abundant with elaborate schemes sharp humor and witty dialogue. Ookami to Koushinryou is more than just a story of bartering it turns into a journey of searching for a lost identity in an ever-changing world.,Adventure;Fantasy;Historical;Romance,2008-01-09,13,540860,114,218,8.32,https://cdn.myanimelist.net/images/anime/5/59401.jpg,https://myanimelist.net/anime/2966/Ookami_to_Koushinryou
38680,Fruits Basket 1st Season,Tooru Honda has always been fascinated by the story of the Chinese Zodiac that her beloved mother told her as a child. However a sudden family tragedy changes her life and subsequent circumstances leave her all alone. Tooru is now forced to live in a tent but little does she know that her temporary home resides on the private property of the esteemed Souma family. Stumbling upon their home one day she encounters Shigure an older Souma cousin and Yuki the prince of her school. Tooru explains that she lives nearby but the Soumas eventually discover her well-kept secret of being homeless when they see her walking back to her tent one night. Things start to look up for Tooru as they kindly offer to take her in after hearing about her situation. But soon after she is caught up in a fight between Yuki and his hot-tempered cousin Kyou. While trying to stop them she learns that the Souma family has a well-kept secret of their own: whenever they are hugged by a member of the opposite sex they transform into the animals of the Chinese Zodiac. With this new revelation Tooru will find that living with the Soumas is an unexpected adventure filled with laughter and romance.,Comedy;Drama;Romance;Shoujo;Slice of Life;Supernatural,2019-04-06,25,188911,582,213,8.32,https://cdn.myanimelist.net/images/anime/1447/99827.jpg,https://myanimelist.net/anime/38680/Fruits_Basket_1st_Season
11843,Danshi Koukousei no Nichijou,Roaming the halls of the all-boys Sanada North High School are three close comrades: the eccentric ringleader with a hyperactive imagination Hidenori the passionate Yoshitake and the rational and prudent Tadakuni. Their lives are filled with giant robots true love and intense drama... in their colorful imaginations at least. In reality they are just an everyday trio of ordinary guys trying to pass the time but who said everyday life couldn't be interesting? Whether it's an intricate RPG reenactment or an unexpected romantic encounter on the riverbank at sunset Danshi Koukousei no Nichijou is rife with bizarre yet hilariously relatable situations that are anything but mundane.,Slice of Life;Comedy;School,2012-01-10,12,470650,151,212,8.32,https://cdn.myanimelist.net/images/anime/3/33257.jpg,https://myanimelist.net/anime/11843/Danshi_Koukousei_no_Nichijou
36649,Banana Fish,Aslan Jade Callenreese known as Ash Lynx was a runaway picked off the streets of New York City and raised by the infamous godfather of the mafia Dino Golzine. Now 17 years old and the boss of his own gang Ash gets his hands on a mysterious drug called Banana Fish—the same two words his older brother Griffin has muttered since his return from the Iraq War. However his investigation is hindered when Dino sends his men to retrieve the drug from Ash at an underground bar he uses as a hideout. At the bar Skip Ash's friend introduces him to Shunichi Ibe and his assistant Eiji Okumura who are Japanese photographers reporting on American street gangs. However their conversation is interrupted when Shorter Wong one of Ash's allies calls to warn him about Dino. Soon Dino's men storm the bar and in the ensuing chaos kidnap Skip and Eiji. Now Ash must find a way to rescue them and continue his investigation into Banana Fish but will his history with the mafia prevent him from succeeding?,Action;Adventure;Drama;Shoujo,2018-07-06,24,183300,597,211,8.32,https://cdn.myanimelist.net/images/anime/1190/93472.jpg,https://myanimelist.net/anime/36649/Banana_Fish
329,Planetes,In 2075 space travel is no longer just a dream but an everyday reality for mankind. Advancements in science and technology have led to the colonization of the moon the commercialization of outer space and the formation of large space corporations. Ai Tanabe an upbeat woman whose interests lie in the cosmos joins Technora Corporation as a member of their Debris Section a department dedicated to the removal of dangerous space junk between the orbits of the Earth and Moon. However Ai soon discovers how unappreciated her job is. As the laughingstock of Technora the Debris Section is severely understaffed poorly funded and is forced to use a dilapidated spaceship nicknamed the Toy Box for debris retrieval. Undeterred Ai perseveres and gradually becomes acquainted with the strange personalities that make up the Debris Section's staff such as the bumbling but good-natured chief clerk Philippe Myers the mysterious and tight-lipped temp worker Edelgard Rivera and the hotheaded and passionate Hachirouta Hoshino who longs for a spaceship to call his own. Planetes is an unconventional sci-fi series that portrays the vastness of space as a backdrop for the personal lives of ordinary people—people who may have been born on Earth but whose hopes and dreams lie amongst the stars.,Drama;Romance;Sci-Fi;Seinen;Space,2003-10-04,26,167683,656,210,8.33,https://cdn.myanimelist.net/images/anime/8/50463.jpg,https://myanimelist.net/anime/329/Planetes
30,Neon Genesis Evangelion,In the year 2015 the world stands on the brink of destruction. Humanity's last hope lies in the hands of Nerv a special agency under the United Nations and their Evangelions giant machines capable of defeating the Angels who herald Earth's ruin. Gendou Ikari head of the organization seeks compatible pilots who can synchronize with the Evangelions and realize their true potential. Aiding in this defensive endeavor are talented personnel Misato Katsuragi Head of Tactical Operations and Ritsuko Akagi Chief Scientist. Face to face with his father for the first time in years 14-year-old Shinji Ikari's average life is irreversibly changed when he is whisked away into the depths of Nerv and into a harrowing new destiny—he must become the pilot of Evangelion Unit-01 with the fate of mankind on his shoulders. Written by Hideaki Anno Neon Genesis Evangelion is a heroic tale of a young boy who will become a legend. But as this psychological drama unfolds ancient secrets beneath the big picture begin to bubble to the surface...,Action;Dementia;Drama;Mecha;Psychological;Sci-Fi,1995-10-04,26,844506,49,208,8.33,https://cdn.myanimelist.net/images/anime/12/21418.jpg,https://myanimelist.net/anime/30/Neon_Genesis_Evangelion
4224,Toradora!,Ryuuji Takasu is a gentle high school student with a love for housework but in contrast to his kind nature he has an intimidating face that often gets him labeled as a delinquent. On the other hand is Taiga Aisaka a small doll-like student who is anything but a cute and fragile girl. Equipped with a wooden katana and feisty personality Taiga is known throughout the school as the Palmtop Tiger. One day an embarrassing mistake causes the two students to cross paths. Ryuuji discovers that Taiga actually has a sweet side: she has a crush on the popular vice president Yuusaku Kitamura who happens to be his best friend. But things only get crazier when Ryuuji reveals that he has a crush on Minori Kushieda—Taiga's best friend! Toradora! is a romantic comedy that follows this odd duo as they embark on a quest to help each other with their respective crushes forming an unlikely alliance in the process.,Slice of Life;Comedy;Romance;School,2008-10-02,25,1153720,14,204,8.34,https://cdn.myanimelist.net/images/anime/13/22128.jpg,https://myanimelist.net/anime/4224/Toradora
31240,Re:Zero kara Hajimeru Isekai Seikatsu,When Subaru Natsuki leaves the convenience store the last thing he expects is to be wrenched from his everyday life and dropped into a fantasy world. Things aren't looking good for the bewildered teenager however not long after his arrival he is attacked by some thugs. Armed with only a bag of groceries and a now useless cell phone he is quickly beaten to a pulp. Fortunately a mysterious beauty named Satella in hot pursuit after the one who stole her insignia happens upon Subaru and saves him. In order to thank the honest and kindhearted girl Subaru offers to help in her search and later that night he even finds the whereabouts of that which she seeks. But unbeknownst to them a much darker force stalks the pair from the shadows and just minutes after locating the insignia Subaru and Satella are brutally murdered. However Subaru immediately reawakens to a familiar scene—confronted by the same group of thugs meeting Satella all over again—the enigma deepens as history inexplicably repeats itself.,Drama;Fantasy;Psychological;Thriller,2016-04-04,25,1018076,23,202,8.34,https://cdn.myanimelist.net/images/anime/11/79410.jpg,https://myanimelist.net/anime/31240/Re_Zero_kara_Hajimeru_Isekai_Seikatsu
19815,No Game No Life,No Game No Life is a surreal comedy that follows Sora and Shiro shut-in NEET siblings and the online gamer duo behind the legendary username Blank. They view the real world as just another lousy game however a strange e-mail challenging them to a chess match changes everything—the brother and sister are plunged into an otherworldly realm where they meet Tet the God of Games. The mysterious god welcomes Sora and Shiro to Disboard a world where all forms of conflict—from petty squabbles to the fate of whole countries—are settled not through war but by way of high-stake games. This system works thanks to a fundamental rule wherein each party must wager something they deem to be of equal value to the other party's wager. In this strange land where the very idea of humanity is reduced to child's play the indifferent genius gamer duo of Sora and Shiro have finally found a real reason to keep playing games: to unite the sixteen races of Disboard defeat Tet and become the gods of this new gaming-is-everything world.,Game;Adventure;Comedy;Supernatural;Ecchi;Fantasy,2014-04-09,12,1291615,8,201,8.34,https://cdn.myanimelist.net/images/anime/5/65187.jpg,https://myanimelist.net/anime/19815/No_Game_No_Life
32937,Kono Subarashii Sekai ni Shukufuku wo! 2,When Kazuma Satou died he was given two choices: pass on to heaven or be revived in a fantasy world. After choosing the new world the goddess Aqua tasked him with defeating the Demon King and let him choose any weapon to aid him. Unfortunately Kazuma chose to bring Aqua herself and has regretted the decision ever since then. Not only is he stuck with a useless deity turned party archpriest the pair also has to make enough money for living expenses. To add to their problems their group continued to grow as more problematic adventurers joined their ranks. Their token spellcaster Megumin is an explosion magic specialist who can only cast one spell once per day and refuses to learn anything else. There is also their stalwart crusader Lalatina Darkness Dustiness Ford a helpless masochist who makes Kazuma look pure in comparison. Kono Subarashii Sekai ni Shukufuku wo! 2 continues to follow Kazuma and the rest of his party through countless more adventures as they struggle to earn money and have to deal with one another's problematic personalities. However things rarely go as planned and they are often sidetracked by their own idiotic tendencies.,Adventure;Comedy;Parody;Supernatural;Magic;Fantasy,2017-01-12,10,656711,80,195,8.35,https://cdn.myanimelist.net/images/anime/2/83188.jpg,https://myanimelist.net/anime/32937/Kono_Subarashii_Sekai_ni_Shukufuku_wo_2
25537,Fate/stay night Movie: Heaven's Feel - I. Presage Flower,The Holy Grail War: a violent battle between mages in which seven masters and their summoned servants fight for the Holy Grail a magical artifact that can grant the victor any wish. Nearly 10 years ago the final battle of the Fourth Holy Grail War wreaked havoc on Fuyuki City and took over 500 lives leaving the city devastated. Shirou Emiya a survivor of this tragedy aspires to become a hero of justice like his rescuer and adoptive father Kiritsugu Emiya. Despite only being a student Shirou is thrown into the Fifth Holy Grail War when he accidentally sees a battle between servants at school and summons his own servant Saber. When a mysterious shadow begins a murderous spree in Fuyuki City Shirou aligns himself with Rin Toosaka a fellow participant in the Holy Grail War in order to stop the deaths of countless people. However Shirou's feelings for his close friend Sakura Matou lead him deeper into the dark secrets surrounding the war and the feuding families involved.,Action;Fantasy;Magic;Supernatural,2017-10-14,1,177110,618,193,8.35,https://cdn.myanimelist.net/images/anime/1274/102213.jpg,https://myanimelist.net/anime/25537/Fate_stay_night_Movie__Heavens_Feel_-_I_Presage_Flower
30346,Doukyuusei (Movie),Rihito Sajou is an honor student who got perfect scores in every subject on his high school entrance exam. Hikaru Kusakabe plays guitar in his band that performs at live events and is popular among the girls. These boys would have never crossed paths. But one day Hikaru offers to help Rihito prepare for their upcoming chorus festival and the two begin to talk. As the two meet after school they feel one another's sound listen to each other's voice and begin to harmonize as their hearts beat together. It starts out slow but soon their feelings for one another grow and in just one moment they both realize that it is love. Hikaru's emotions are frivolous pure and direct causing Rihito to hesitate at first but he gradually opens his heart. The boys are learning about each other as they also learn about themselves and support one another during this difficult time typical to youth. As the time to start thinking about their futures approaches what do these young men find as they try to move forward... (Source: Aniplex USA),Slice of Life;Romance;School;Shounen Ai,2016-02-20,1,97504,1137,192,8.35,https://cdn.myanimelist.net/images/anime/3/78606.jpg,https://myanimelist.net/anime/30346/Doukyuusei_Movie
31964,Boku no Hero Academia,The appearance of quirks newly discovered super powers has been steadily increasing over the years with 80 percent of humanity possessing various abilities from manipulation of elements to shapeshifting. This leaves the remainder of the world completely powerless and Izuku Midoriya is one such individual. Since he was a child the ambitious middle schooler has wanted nothing more than to be a hero. Izuku's unfair fate leaves him admiring heroes and taking notes on them whenever he can. But it seems that his persistence has borne some fruit: Izuku meets the number one hero and his personal idol All Might. All Might's quirk is a unique ability that can be inherited and he has chosen Izuku to be his successor! Enduring many months of grueling training Izuku enrolls in UA High a prestigious high school famous for its excellent hero training program and this year's freshmen look especially promising. With his bizarre but talented classmates and the looming threat of a villainous organization Izuku will soon learn what it really means to be a hero.,Action;Comedy;School;Shounen;Super Power,2016-04-03,13,1223690,12,191,8.35,https://cdn.myanimelist.net/images/anime/10/78745.jpg,https://myanimelist.net/anime/31964/Boku_no_Hero_Academia
57,Beck,Fourteen-year-old Yukio Koyuki Tanaka is a dispirited young boy with no goals in life. However this all changes when Koyuki saves a strange-looking dog named Beck from being harassed by a group of local kids. The dog's owner 16-year-old Ryuusuke Ray Minami is an emerging guitarist and the former member of a popular rock band. After Koyuki meets Ray again in a diner the older boy leads him to his former band's meeting place and dazzles Koyuki with his amazing guitar skills. Slowly becoming interested in the glamour of western rock culture Koyuki decides to start playing the guitar while helping Ray achieve his dream of leading the ultimate rock band. Together with Ray's younger sister Maho and a few other members the two boys launch their career into the world of rock by forming a band called BECK. Beck follows the group's struggles and successes as they spread their fame across Japan.,Comedy;Drama;Music;Shounen;Slice of Life,2004-10-07,26,217764,489,190,8.35,https://cdn.myanimelist.net/images/anime/11/11636.jpg,https://myanimelist.net/anime/57/Beck
5081,Bakemonogatari,Koyomi Araragi a third-year high school student manages to survive a vampire attack with the help of Meme Oshino a strange man residing in an abandoned building. Though being saved from vampirism and now a human again several side effects such as superhuman healing abilities and enhanced vision still remain. Regardless Araragi tries to live the life of a normal student with the help of his friend and the class president Tsubasa Hanekawa. When fellow classmate Hitagi Senjougahara falls down the stairs and is caught by Araragi the boy realizes that the girl is unnaturally weightless. Despite Senjougahara's protests Araragi insists he help her deciding to enlist the aid of Oshino the very man who had once helped him with his own predicament. Through several tales involving demons and gods Bakemonogatari follows Araragi as he attempts to help those who suffer from supernatural maladies.,Romance;Supernatural;Mystery;Vampire,2009-07-03,15,834574,51,189,8.35,https://cdn.myanimelist.net/images/anime/11/75274.jpg,https://myanimelist.net/anime/5081/Bakemonogatari
2418,Stranger: Mukou Hadan,In the Sengoku period of Japan a young orphan named Kotarou and his dog Tobimaru steal from unsuspecting villagers in order to make ends meet. However Kotarou is forced to remain on the run when he finds himself being hunted down by assassins sent by China's Ming Dynasty for mysterious reasons not involving his petty crimes. Fortunately the duo run into Nanashi a ronin who has taken refuge in a small temple when Kotarou is attacked and Tobimaru poisoned. Although the samurai saves the helpless pair from their pursuers he feels that there is no need to help them further but when offered a gem in exchange for his services as a bodyguard he reluctantly accepts Kotarou's offer of employment—just until Tobimaru is healed and the two reach their destination. As the three set out on a perilous journey it soon becomes evident that their path is riddled with danger as the Ming Dynasty has now sent a terrifying swordsman after them to capture Kotarou and fulfill a certain prophecy.,Action;Adventure;Historical;Samurai,2007-09-29,1,217756,488,185,8.36,https://cdn.myanimelist.net/images/anime/9/87066.jpg,https://myanimelist.net/anime/2418/Stranger__Mukou_Hadan
35788,Shokugeki no Souma: San no Sara,The Moon Festival is Tootsuki Academy's annual gourmet gala where students compete against each other to earn the most profit through selling their cuisine of choice. But for Souma Yukihira it is also his first opportunity to challenge the Elite Ten the supreme council that rules over the academy. However this is only the beginning of Souma's war against the Elite Ten a nefarious plot is underway that will provide Souma with the challenge he desires but will also shake the very foundations of Tootsuki Academy itself.,Ecchi;School;Shounen,2017-10-04,12,426357,187,184,8.36,https://cdn.myanimelist.net/images/anime/3/88434.jpg,https://myanimelist.net/anime/35788/Shokugeki_no_Souma__San_no_Sara
1210,NHK ni Youkoso!,Twenty-two-year-old college dropout Tatsuhiro Satou has been a hikikomori for almost four years now. In his isolation he has come to believe in many obscure conspiracy theories but there is one in particular which he holds unshakable faith in: the theory that the evil conspirator behind his shut-in NEET (Not in Employment Education or Training) status is the Nihon Hikikomori Kyokai (NHK)—an evil and secret organization dedicated to fostering the spread of hikikomori culture. NHK ni Youkoso! is a psychological dramedy that follows Tatsuhiro as he strives to escape from the NHK's wicked machinations and the disease of self-wrought isolation while struggling to even just leave his apartment and find a job. His unexpected encounter with the mysterious Misaki Nakahara might signal a reversal of fortune for Tatsuhiro but with this meeting comes the inevitable cost of having to face his greatest fear—society.,Comedy;Psychological;Drama;Romance,2006-07-10,24,461723,157,182,8.36,https://cdn.myanimelist.net/images/anime/3/52675.jpg,https://myanimelist.net/anime/1210/NHK_ni_Youkoso
513,Tenkuu no Shiro Laputa,In a world filled with planes and airships Sheeta is a young girl who has been kidnapped by government agents who seek her mysterious crystal amulet. While trapped aboard an airship she finds herself without hope—that is until the ship is raided by pirates. Taking advantage of the ensuing confusion Sheeta manages to flee from her captors. Upon her escape she meets Pazu a boy who dreams of reaching the fabled flying castle Laputa. The two decide to embark on a journey together to discover this castle in the sky. However they soon find the government agents back on their trail as they too are trying to reach Laputa for their own greedy purposes. Tenkuu no Shiro Laputa follows the soaring adventures of Sheeta and Pazu all while they learn how dreams and dire circumstances can bring two people closer together.,Adventure;Fantasy;Romance;Sci-Fi,1986-08-02,1,255742,387,179,8.37,https://cdn.myanimelist.net/images/anime/5/37799.jpg,https://myanimelist.net/anime/513/Tenkuu_no_Shiro_Laputa
45,Rurouni Kenshin: Meiji Kenkaku Romantan,In the final years of the Bakumatsu era lived a legendary assassin known as Hitokiri Battousai. Feared as a merciless killer he was unmatched throughout the country but mysteriously disappeared at the peak of the Japanese Revolution. It has been ten peaceful years since then but the very mention of Battousai still strikes terror into the hearts of war veterans. Unbeknownst to them Battousai has abandoned his bloodstained lifestyle in an effort to repent for his sins now living as Kenshin Himura a wandering swordsman with a cheerful attitude and a strong will. Vowing never to kill again Kenshin dedicates himself to protecting the weak. One day he stumbles across Kaoru Kamiya at her kendo dojo which is being threatened by an impostor claiming to be Battousai. After receiving help from Kenshin Kaoru allows him to stay at the dojo and so the former assassin temporarily ceases his travels. Rurouni Kenshin: Meiji Kenkaku Romantan tells the story of Kenshin as he strives to save those in need of saving. However as enemies from both past and present begin to emerge will the reformed killer be able to uphold his new ideals?,Action;Adventure;Comedy;Historical;Romance;Samurai;Shounen,1996-01-10,94,328520,294,178,8.37,https://cdn.myanimelist.net/images/anime/7/6803.jpg,https://myanimelist.net/anime/45/Rurouni_Kenshin__Meiji_Kenkaku_Romantan
4081,Natsume Yuujinchou,While most fifteen-year-old boys in one way or another harbor secrets that are related to girls Takashi Natsume has a peculiar and terrifying secret involving youkai: for as long as he can remember he has been constantly chased by these spirits. Natsume soon discovers that his deceased grandmother Reiko had passed on to him the Yuujinchou or Book of Friends which contains the names of the spirits whom she brought under her control. Now in Natsume's possession the book gives Reiko's grandson this power as well which is why these enraged beings now haunt him in hopes of somehow attaining their freedom. Without parents and a loving home and constantly being hunted by hostile merciless youkai Natsume is looking for solace—a place where he belongs. However his only companion is a self-proclaimed bodyguard named Madara. Fondly referred to as Nyanko-sensei Madara is a mysterious pint-sized feline spirit who has his own reasons for sticking with the boy. Based on the critically acclaimed manga by Yuki Midorikawa Natsume Yuujinchou is an unconventional and supernatural slice-of-life series that follows Natsume as he with his infamous protector Madara endeavors to free the spirits bound by his grandmother's contract.,Slice of Life;Demons;Supernatural;Drama;Shoujo,2008-07-08,13,344207,276,176,8.37,https://cdn.myanimelist.net/images/anime/7/28859.jpg,https://myanimelist.net/anime/4081/Natsume_Yuujinchou
