id,title,synopsis,genres,release_date,episodes,members,popularity,ranked,score,img_url,link
19769,Mahou Sensou,The world as we know it is actually just half the story as Takeshi Nanase finds out abruptly one summer morning. On his way to kendo practice Takeshi comes across an unconscious girl in a uniform he doesn't recognize. Takeshi does the decent thing and saves her and in return the girl wakes up and accidentally turns him into a magic-user. As Takeshi finds out there is the world he lives in and the world of magic users. Most magic users just want to peacefully coexist with non-magicians but there are some with bigger ambitions. Mui Aiba is a magician enrolled in the Subaru Magic Academy where magic users can learn to control and channel their powers and how to live in peace with regular humans. After his fateful encounter with Mui Takeshi and his newly magician friends Kurumi Isoshima and Kazumi Ida decide to enroll in the Magic Academy as well. All three friends have different reasons for fighting on whether they're fighting to escape the past or catch up to the future. They wield different kinds of powers which they must learn to harness in order to fight off the Ghost Trailers a group of magicians who are willing to use violence to assert their superiority over humans. Pursued by the Ghost Trailers Takeshi and his friends must train to become stronger face the leader of the Trailers and prevent the beginning of the Second Great Magic War.,Action;Fantasy;Magic,2014-01-10,12,169904,645,7897,6.12,https://cdn.myanimelist.net/images/anime/3/58103.jpg,https://myanimelist.net/anime/19769/Mahou_Sensou
21507,Soul Eater NOT!,Soul Eater NOT! is a spin-off and side story that takes place one year prior to the events of the original Soul Eater . At the Death Weapon Meister Academy humans born with the power to transform into weapons and those with the power to wield these weapons (Meisters) train to hone their natural talent. The characters of the main series are enrolled in the Especially Advantaged Talent class where they train to become warriors of justice capable of defeating what threats prey on innocent lives—or even the entire world. Other students at the DWMA are less talented. Members of the Normally Overcome Target class focus less on being warriors of justice and more on controlling their powers so they don't hurt themselves or anyone around them. Tsugumi Harudori a new halberd-transforming student meets Meisters Meme Tatane and Anya Hepburn and quickly grows indecisive about which of the two new friends should be her partner. As they learn to use these powers and settle in their lives as everyday students will be far from normal.,Action;Comedy;Ecchi;Shounen;Supernatural,2014-04-09,12,140815,792,7868,6.13,https://cdn.myanimelist.net/images/anime/8/61889.jpg,https://myanimelist.net/anime/21507/Soul_Eater_NOT
1639,Boku no Pico,Upbeat and effeminate Pico is working at his grandfather's coffee shop Café Bebe for the summer. Tamotsu is a white-collar worker looking for an escape from the mundanity of his everyday life. When they meet at the café sparks of love and lust quickly draw the two together. Conventional notions of age gender and sexuality are broken down as the pair seeks carnal gratification in one another's company. But do the pleasures of flesh equate to a connection between hearts?,Hentai;Yaoi,2006-09-07,1,97619,1122,-9223372036854775808,4.85,https://cdn.myanimelist.net/images/anime/12/39497.jpg,https://myanimelist.net/anime/1639/Boku_no_Pico
11785,Haiyore! Nyaruko-san,Mahiro Yasaka is just an ordinary high school student until one day he is suddenly attacked by a dangerous monster. Just when everything seems to be lost he is saved by a silver-haired girl named Nyaruko who claims to be the shape-shifting deity Nyarlathotep from horror author H. P. Lovecraft's Cthulhu Mythos sent by the Space Defense Agency to Earth. She explains to Mahiro that the creature chasing him was an alien called Nightgaunt who had planned on abducting and selling him as a slave. After rescuing him from the alien the Lovecraftian deity falls madly in love with Mahiro and forces herself into his household much to his chagrin. Moreover they are soon joined by two others from the fictional universe: Cthuko a girl obsessed with Nyaruko and Hasuta a young boy easily mistaken for a beautiful female. Together the three eccentric aliens protect Mahiro from the various extraterrestrial dangers that threaten both his and Earth's well-being all the while making his life a living hell.,Sci-Fi;Comedy;Parody,2012-04-10,12,243705,414,3130,7.16,https://cdn.myanimelist.net/images/anime/6/49081.jpg,https://myanimelist.net/anime/11785/Haiyore_Nyaruko-san
34572,Black Clover,Asta and Yuno were abandoned at the same church on the same day. Raised together as children they came to know of the Wizard King—a title given to the strongest mage in the kingdom—and promised that they would compete against each other for the position of the next Wizard King. However as they grew up the stark difference between them became evident. While Yuno is able to wield magic with amazing power and control Asta cannot use magic at all and desperately tries to awaken his powers by training physically. When they reach the age of 15 Yuno is bestowed a spectacular Grimoire with a four-leaf clover while Asta receives nothing. However soon after Yuno is attacked by a person named Lebuty whose main purpose is to obtain Yuno's Grimoire. Asta tries to fight Lebuty but he is outmatched. Though without hope and on the brink of defeat he finds the strength to continue when he hears Yuno's voice. Unleashing his inner emotions in a rage Asta receives a five-leaf clover Grimoire a Black Clover giving him enough power to defeat Lebuty. A few days later the two friends head out into the world both seeking the same goal—to become the Wizard King!,Action;Comedy;Magic;Fantasy;Shounen,2017-10-03,-9223372036854775808,456083,162,3120,7.16,https://cdn.myanimelist.net/images/anime/2/88336.jpg,https://myanimelist.net/anime/34572/Black_Clover
1829,Gedo Senki,Something bizarre has come over the land. The kingdom is deteriorating. People are beginning to act strange... What's even more strange is that people are beginning to see dragons which shouldn't enter the world of humans. Due to all these bizarre events Ged a wandering wizard is investigating the cause. During his journey he meets Prince Arren a young distraught teenage boy. While Arren may look like a shy young teen he has a severe dark side which grants him strength hatred ruthlessness and has no mercy especially when it comes to protecting Tehanu. For the witch Kumo this is a perfect opportunity. He can use the boy's fears against the very one who would help him Ged. (Source: ANN),Adventure;Fantasy;Magic,2006-07-29,1,85145,1276,3500,7.07,https://cdn.myanimelist.net/images/anime/5/73443.jpg,https://myanimelist.net/anime/1829/Gedo_Senki
1726,Devil May Cry,Devil May Cry follows the story of the demon hunter known as Dante. As a half demon half human he uses his trusty sword Rebellion and his two guns Ebony and Ivory to take on missions. Dante owns and runs Devil May Cry a business that specializes in hunting and killing demon-related problems. Based on the video game series Devil May Cry.,Action;Demons;Fantasy,2007-06-14,12,231960,447,3491,7.07,https://cdn.myanimelist.net/images/anime/4/26417.jpg,https://myanimelist.net/anime/1726/Devil_May_Cry
15451,High School DxD New,The misadventures of Issei Hyoudou high school pervert and aspiring Harem King continue on in High School DxD New . As the members of the Occult Research Club carry out their regular activities it becomes increasingly obvious that there is something wrong with their Knight the usually composed and alert Yuuto Kiba. Soon Issei learns of Kiba's dark bloody past and its connection to the mysterious Holy Swords. Once the subject of a cruel experiment Kiba now seeks revenge on all those who wronged him. With the return of an old enemy as well as the appearance of two new Holy Sword-wielding beauties it isn't long before Issei and his Devil comrades are plunged into a twisted plot once more.,Action;Harem;Comedy;Demons;Romance;Ecchi;School,2013-07-07,12,511511,129,1196,7.68,https://cdn.myanimelist.net/images/anime/12/47729.jpg,https://myanimelist.net/anime/15451/High_School_DxD_New
32729,Orange,Naho Takamiya's first day of her sophomore year of high school is off to an uneasy start. After waking up late she receives a strange letter addressed to her. However the letter is from herself—10 years in the future! At first Naho is skeptical of the note yet after witnessing several events described to take place she realizes the letter really is from her 26-year-old self. The note details that Naho's future life is filled with regrets and she hopes that her younger self can correct the mistakes that were made in the past. The letter also warns her to keep a close eye on the new transfer student Kakeru Naruse. Naho must be especially careful in making decisions involving him as Kakeru is not around in the future. With the letter as her guide Naho now has the power to protect Kakeru before she comes to regret it once more.,Sci-Fi;Drama;Romance;School;Shoujo,2016-07-04,13,379536,236,1186,7.69,https://cdn.myanimelist.net/images/anime/4/80110.jpg,https://myanimelist.net/anime/32729/Orange
15315,Mondaiji-tachi ga Isekai kara Kuru Sou Desu yo?,Izayoi Sakamaki Asuka Kudou and You Kasukabe are extraordinary teenagers who are blessed with psychic powers but completely fed up with their disproportionately mundane lives—until unexpectedly each of them receives a strange envelope containing an invitation to a mysterious place known as Little Garden. Inexplicably dropped into a vast new world the trio is greeted by Kurousagi who explains that they have been given a once-in-a-lifetime chance to participate in special high-stakes games using their abilities. In order to take part however they must first join a community. Learning that Kurousagi's community No Names has lost its official status and bountiful land due to their defeat at the hands of a demon lord the group sets off to help reclaim their new home's dignity eager to protect its residents and explore the excitement that Little Garden has to offer.,Action;Comedy;Fantasy;Supernatural,2013-01-12,10,385072,227,1184,7.69,https://cdn.myanimelist.net/images/anime/12/43369.jpg,https://myanimelist.net/anime/15315/Mondaiji-tachi_ga_Isekai_kara_Kuru_Sou_Desu_yo
27655,Aldnoah.Zero 2nd Season,The war between the Terrans and the Vers Empire of Mars has ended allowing humanity to blissfully enjoy their lives in a time of peace. Nineteen months later however the Vers princess makes a shocking public declaration: the Terrans are a foolish race that covets resources destroys nature and are devoted to the pursuit of pleasure. And so to protect their precious Earth she calls upon her knights to take up arms and the raging battle between the two civilizations reignites. Slaine Troyard has found a place among the Martians giving Earth a short respite from the war against the Vers Empire. However a peaceful resolution seems inconceivable. The various people who fought desperately for survival in the past now find themselves in the midst of yet another bloody and chaotic conflict one that will forever alter the fate of humankind.,Action;Mecha;Sci-Fi;Space,2015-01-11,12,233380,444,3487,7.07,https://cdn.myanimelist.net/images/anime/10/71297.jpg,https://myanimelist.net/anime/27655/AldnoahZero_2nd_Season
11751,Senki Zesshou Symphogear,Tsubasa Kazanari and Kanade Amou—the idol duo known as Zwei Wing—use their songs to power ancient weapons known as symphogears to combat a deadly alien race called the Noise. While the general public is aware of the Noise's existence knowledge of the symphogears are kept a secret. When the Noise attack one of Zwei Wing's concerts Kanade sacrifices herself to protect a young girl named Hibiki Tachibana leaving Tsubasa devastated and a fragment of her symphogear embedded within Hibiki. Two years pass and Hibiki is once again dragged into a Noise attack. While rescuing a young girl who has been left behind during the evacuation she awakens the power of Kanade's symphogear lying within her. Although Tsubasa still grieves over the loss of Kanade both girls must now learn to work together using their powers to defend humanity against the Noise.,Action;Sci-Fi;Music,2012-01-06,13,83242,1311,3480,7.08,https://cdn.myanimelist.net/images/anime/11/75580.jpg,https://myanimelist.net/anime/11751/Senki_Zesshou_Symphogear
33003,Mahou Shoujo Ikusei Keikaku,For many individuals in N-City playing the popular social role-playing game Magical Girl Raising Project is as close as they could come to being a real magical girl. However for some rare players that dream can become a reality. One such girl is Koyuki Himekawa who receives a notification one night that she has been selected to become a magical girl her in-game avatar Snow White. As Koyuki and other chosen players in the city begin helping those in need they all receive yet another notification: the admins have decided that they want to reduce the number of magical girls. Whoever collects the least amount of Magical Candies—which are awarded for their magical girl activities—in their competition each week will lose their powers. But when a real-world tragedy happens to the first player that drops out they are shown the repercussions of losing their abilities. As more participants inevitably lose the competition and more twisted rules are added the girls soon realize that their contest is actually a desperate fight for survival.,Action;Supernatural;Magic;Thriller;Fantasy,2016-10-02,12,109948,1018,3467,7.08,https://cdn.myanimelist.net/images/anime/2/81087.jpg,https://myanimelist.net/anime/33003/Mahou_Shoujo_Ikusei_Keikaku
226,Elfen Lied,Lucy is a special breed of human referred to as Diclonius born with a short pair of horns and invisible telekinetic hands that lands her as a victim of inhumane scientific experimentation by the government. However once circumstances present her an opportunity to escape Lucy corrupted by the confinement and torture unleashes a torrent of bloodshed as she escapes her captors. During her breakout she receives a crippling head injury that leaves her with a split personality: someone with the mentality of a harmless child possessing limited speech capacity. In this state of instability she stumbles upon two college students Kouta and his cousin Yuka who unknowingly take an injured fugitive into their care unaware of her murderous tendencies. This act of kindness will change their lives as they soon find themselves dragged into the shadowy world of government secrecy and conspiracy.,Action;Horror;Psychological;Supernatural;Drama;Romance;Seinen,2004-07-25,13,993395,26,1173,7.69,https://cdn.myanimelist.net/images/anime/10/6883.jpg,https://myanimelist.net/anime/226/Elfen_Lied
32438,Mayoiga,A bus full of eccentric individuals is headed towards the urban legend known as Nanaki Village a place where one can supposedly start over and live a perfect life. While many have different ideas of why the village cannot be found on any map or why even the police cannot pinpoint its location they each look forward to their new lives and just what awaits them once they reach their destination. After a few mishaps they successfully arrive at Nanaki Village only to find it completely abandoned. Judging from the state of disrepair it has been vacant for at least a year. However secrets are soon revealed as some of the group begin to go missing while exploring the village and amidst the confusion they find bloody claw marks in a forest. As mistrust and in-fighting break out will they ever be able to figure out the truth behind this lost village?,Mystery;Comedy;Horror;Psychological;Drama,2016-04-01,12,170583,640,9605,5.6,https://cdn.myanimelist.net/images/anime/4/79413.jpg,https://myanimelist.net/anime/32438/Mayoiga
17513,Diabolik Lovers,At the behest of her father Yui Komori goes to live in a secluded mansion home to the six Sakamaki brothers—Shuu Reiji Ayato Kanato Laito and Subaru—a family of vampires. Though at first the siblings are confused as to why the girl has arrived they soon realize that she is to be their new sacrificial bride not to mention their other more carnal intentions for her. After meeting the brothers Yui quickly begins to question why her father would have sent her here and why she feels a strange new pain in her chest. With each brother more sadistic than the last Yui's life as a captive takes a harrowing turn in her new home. As her days turn into endless nights and each brother vows to make her his own Yui falls deeper and deeper into madness and ecstasy.,Harem;School;Shoujo;Vampire,2013-09-16,12,183690,594,9596,5.6,https://cdn.myanimelist.net/images/anime/9/51989.jpg,https://myanimelist.net/anime/17513/Diabolik_Lovers
22687,Terra Formars,During the 21st century humanity attempted to colonize Mars by sending two species which could endure the harsh environment of the planet to terraform it—algae and cockroaches. However they did not anticipate the species' remarkable ability to adapt. Now in the 26th century a lethal disease known as the Alien Engine Virus has arrived on Earth and the cure is suspected to be found only on Mars. The problem is Mars in the present is overrun by creatures known as Terraformars incredibly powerful and intelligent humanoid cockroaches that mutated from those originally sent to the planet. The Annex I team consisting of a hundred men and women genetically enhanced with characteristics of powerful organisms from earth has been sent to Mars on a mission to find the cause of the Alien Engine Virus and to help cure humanity—signalling the start of the crew's fight for survival.,Action;Sci-Fi;Space;Horror;Drama;Seinen,2014-09-27,13,158503,701,3406,7.1,https://cdn.myanimelist.net/images/anime/2/67117.jpg,https://myanimelist.net/anime/22687/Terra_Formars
20047,Sakura Trick,Having been best friends since middle school Haruka Takayama and Yuu Sonoda plan to attend Misato West High School together. However despite being assigned to the same class a cruel twist of fate has them seated on the opposite ends of their classroom! To make matters worse their school will shut down in three years making them the final intake of first-year students. Undeterred by this chain of unfortunate events Haruka is set on sticking with Yuu striving to create many wonderful memories with her. Much to Haruka's jealousy however Yuu's easygoing demeanor quickly attracts the attention of their female classmates. Sympathizing with her friend's growing insecurity Yuu ends up sharing a deep affectionate kiss with her in an empty classroom. The act intensifies their bond as special friends gradually revealing a different aspect to their unique friendship while also inviting new conflicts.,Slice of Life;Comedy;Romance;School;Seinen;Shoujo Ai,2014-01-10,12,175585,622,3401,7.1,https://cdn.myanimelist.net/images/anime/2/56189.jpg,https://myanimelist.net/anime/20047/Sakura_Trick
4214,Rosario to Vampire Capu2,It has been one year since Tsukune Aono enrolled at Youkai Academy and since then his life has taken an interesting turn. In addition to being the only human at a school for monsters he has attracted a bevy of beautiful women who want him all for themselves: the sexy succubus Kurumu Kurono Yukari Sendou a witch stalker and yuki-onna Mizore Shirayuki and Moka Akashiya a kind vampire who when her rosary is removed reveals a darker personality. But soon trouble visits Youkai Academy in the form of Moka's younger sister Kokoa Shuzen. She is furious that her true older sister is sealed within Moka's rosary and vows to bring out Moka's darker self. However Kokoa's thoughtless actions may affect more than just her sister...,Comedy;Ecchi;Fantasy;Harem;Romance;School;Vampire,2008-10-02,13,296600,329,3398,7.1,https://cdn.myanimelist.net/images/anime/6/25093.jpg,https://myanimelist.net/anime/4214/Rosario_to_Vampire_Capu2
31953,New Game!,Since childhood Aoba Suzukaze has loved the Fairies Story game series particularly the character designs. So when she graduates from high school it is no surprise that she applies to work at Eagle Jump the company responsible for making her favorite video game. On her first day she is excited to learn that she will be working on a new installment to the series: Fairies Story 3—and even more so under Kou Yagami the lead character designer. In their department are people who share the same passion for games. There is Yun Iijima whose specialty is designing monsters the shy Hifumi Takimoto who prefers to communicate through instant messaging Hajime Shinoda an animation team member with an impressive figurine collection Rin Tooyama the orderly art director Shizuku Hazuki the game director who brings her cat to work and Umiko Ahagon the short-tempered head programmer. New Game! follows Aoba and the others on their adventure through the ups and downs of game making from making the perfect character design to fixing all the errors that will inevitably accumulate in the process.,Game;Slice of Life;Comedy,2016-07-04,12,266864,374,1162,7.7,https://cdn.myanimelist.net/images/anime/9/80417.jpg,https://myanimelist.net/anime/31953/New_Game
2593,Kara no Kyoukai 1: Fukan Fuukei,In September 1998 a string of seemingly random suicides leaves Japan baffled and devastated. But a detective agency specializing in paranormal occurrences notices that there are a few glaring disturbing similarities tying the deceptively unrelated cases together: All the victims are schoolgirls and all of them have jumped to their deaths from atop the ancient Fujou Building a skyscraper that is scheduled to be bulldozed soon. To investigate the cause of these disturbing events the head of the agency magus Touko Aozaki dispatches Mikiya Kokutou and Shiki Ryougi. The kind and surprisingly normal Mikiya serves as a stark contrast to the cold and mysterious Shiki who possesses the Mystic Eyes of Death Perception: an abnormal ability which allows her to see and bring an end to all things. Dark and philosophical in tone Fukan Fuukei is the first installment in the seven-part movie series Kara no Kyoukai  adapted from the light novels by Kinoko Nasu.,Action;Mystery;Supernatural;Thriller,2007-12-01,1,273809,358,1160,7.7,https://cdn.myanimelist.net/images/anime/12/21741.jpg,https://myanimelist.net/anime/2593/Kara_no_Kyoukai_1__Fukan_Fuukei
8086,Densetsu no Yuusha no Densetsu,Alpha Stigma are known to be eyes that can analyze all types of magic. However they are more infamously known as cursed eyes that can only bring destruction and death to others. Ryner Lute a talented mage and also an Alpha Stigma bearer was once a student of the Roland Empire's Magician Academy an elite school dedicated to training magicians for military purposes. However after many of his classmates died in a war he makes an oath to make the nation a more orderly and peaceful place with fellow survivor and best friend Sion Astal. Now that Sion is the the king of Roland he orders Ryner to search for useful relics that will aid the nation. Together with Ferris Eris a beautiful and highly skilled swordswoman Ryner goes on a journey to search for relics of legendary heroes from the past and also uncover the secrets behind his cursed eyes.,Action;Adventure;Magic;Fantasy;Shounen,2010-07-02,24,212379,505,1152,7.7,https://cdn.myanimelist.net/images/anime/8/73651.jpg,https://myanimelist.net/anime/8086/Densetsu_no_Yuusha_no_Densetsu
31405,Joker Game,With World War II right around the corner intelligence on other countries' social and economic situation has become a valuable asset. As a result Japan has established a new spy organization known as the D Agency to obtain this weapon. Under the command of Lieutenant Colonel Yuuki eight agents have been assigned to infiltrate and observe some of the most powerful countries reporting on any developments associated with the war. In order to carry out these dangerous tasks these men have trained their bodies to survive in extreme conditions and studied numerous fields such as communications and languages. However their greatest strength lies in their ability to manipulate people in order to obtain the information necessary to give their nation the upper hand.,Military;Historical;Drama,2016-04-05,12,158537,700,3380,7.1,https://cdn.myanimelist.net/images/anime/9/77523.jpg,https://myanimelist.net/anime/31405/Joker_Game
